iteration	method	change	metric	guard	decision	note
1	two_pass	smoke mistral 4k k=16	niah=1.000	self_test+remote_smoke	keep	immediate retrieval recovery on bounded smoke
2	query_dequant	smoke mistral 4k s=0.25	niah=0.000	self_test+remote_smoke	discard	no recovery on bounded smoke
3	sharp_temp	smoke mistral 4k t=0.7	niah=0.000	self_test+remote_smoke	discard	no recovery on bounded smoke
4	all_methods	mistral 4k compare	baseline_2bit=0.333; two_pass_k16=1.000; best_query_dequant=0.333; best_sharp_temp=0.000	full_run_ok	keep_only_two_pass	two_pass clearly dominates same-harness controls
5	two_pass	mistral 4k sweep k={8,16,32,64}	all_niah=1.000	full_run_ok	keep	all tested budgets saturate retrieval at 4k
6	two_pass	qwen 4k sweep k={8,16,32,64}	all_niah=1.000	full_run_ok	keep	generalizes across model family on bounded 4k grid
